{
  "id": "design-article-layout-mapping",
  "rev": "2-7fc12da169997694a5f3a285db5ba003",
  "name": "designArticleLayoutMapping",
  "classification": "layout-mapping",
  "type": {
    "id": "a8fa51a3-4919-4308-a0b3-6cd31ae15d7e",
    "name": "Design article"
  },
  "mappings": [
    {
      "defaultLayout": {
        "id": "design-article-layout",
        "name": "Design article"
      },
      "layouts": [
        {
          "id": "design-article-layout",
          "name": "Design article"
        }
      ]
    }
  ]
}