{
  "id": "design-article-layout-mapping",
  "rev": "1-9ff2f9680194978a05018df0c0768c88",
  "name": "designArticleLayoutMapping",
  "classification": "layout-mapping",
  "type": {
    "id": "a8fa51a3-4919-4308-a0b3-6cd31ae15d7e"
  },
  "mappings": [
    {
      "defaultLayout": {
        "id": "design-article-layout"
      },
      "layouts": [
        {
          "id": "design-article-layout"
        }
      ]
    }
  ]
}