{
  "id": "text-component-layout-mapping",
  "rev": "1-884c6b69ab15a638e94b0eada4f008e4",
  "name": "textComponentLayoutMapping",
  "classification": "layout-mapping",
  "type": {
    "id": "09ed64f3-23d9-48bb-871d-e00430751ea6"
  },
  "mappings": [
    {
      "defaultLayout": {
        "id": "text-component-layout"
      },
      "layouts": [
        {
          "id": "text-component-layout"
        }
      ]
    }
  ]
}