{
  "id": "sites-image-layout-mapping",
  "rev": "1-1bf14278518d3669c5af32668a95ec37",
  "name": "sitesImageLayoutMapping",
  "classification": "layout-mapping",
  "tags": [
    "sites-next"
  ],
  "type": {
    "id": "c8295d37-7235-495e-8d40-f3b8bafe4099"
  },
  "mappings": [
    {
      "defaultLayout": {
        "id": "sites-image-layout"
      },
      "layouts": [
        {
          "id": "sites-image-layout"
        }
      ]
    }
  ]
}