{
  "id": "sites-html-layout-mapping",
  "rev": "1-e0ff3f9100a1c08db9ac14a5b85ac8da",
  "name": "sitesHtmlLayoutMapping",
  "classification": "layout-mapping",
  "tags": [
    "sites-next"
  ],
  "type": {
    "id": "85bdc88c-5b4c-4002-a665-37ba5bf95cb6"
  },
  "mappings": [
    {
      "defaultLayout": {
        "id": "sites-html-layout"
      },
      "layouts": [
        {
          "id": "sites-html-layout"
        }
      ]
    }
  ]
}