{
  "id": "sites-text-layout-mapping",
  "rev": "1-e961c12ac165d0180d516012fa83920a",
  "name": "sitesTextLayoutMapping",
  "classification": "layout-mapping",
  "tags": [
    "sites-next"
  ],
  "type": {
    "id": "373c81a5-d86b-4740-8f11-62fcbccfca08"
  },
  "mappings": [
    {
      "defaultLayout": {
        "id": "sites-text-layout"
      },
      "layouts": [
        {
          "id": "sites-text-layout"
        }
      ]
    }
  ]
}