{
  "id": "carousel-list-mapping",
  "rev": "1-64a90e6d701d6d5877419252f9f4a004",
  "name": "carouselListMapping",
  "classification": "layout-mapping",
  "type": {
    "id": "9aeeecef-85ce-4d41-a797-1ad27735d0cb"
  },
  "mappings": [
    {
      "defaultLayout": {
        "id": "carousel-list"
      },
      "layouts": [
        {
          "id": "carousel-list"
        },
        {
          "id": "gallery-list"
        },
        {
          "id": "vertical-list"
        }
      ]
    }
  ]
}